{
  "date": "2026-10-30",
  "dayNumber": 15,
  "prompts": [
    {
      "answers": [
        {
          "aliases": [
            "Mangga",
            "Philippine mango",
            "Carabao mango"
          ],
          "answer": "Mango",
          "tier": "plankton"
        },
        {
          "aliases": [
            "Peaches",
            "Melocoton"
          ],
          "answer": "Peach",
          "tier": "plankton"
        },
        {
          "aliases": [
            "Abukado",
            "Avocados"
          ],
          "answer": "Avocado",
          "tier": "plankton"
        },
        {
          "aliases": [
            "Cherries",
            "Cereza"
          ],
          "answer": "Cherry",
          "tier": "plankton"
        },
        {
          "aliases": [
            "Plums",
            "Ciruela"
          ],
          "answer": "Plum",
          "tier": "plankton"
        },
        {
          "aliases": [
            "Olives",
            "Azeitona"
          ],
          "answer": "Olive",
          "quip": "Botanical technicality alert! Yes, olives are stone fruits, martini drinkers rejoice.",
          "tier": "tooclever"
        },
        {
          "aliases": [
            "Niyog",
            "Buko",
            "Coco"
          ],
          "answer": "Coconut",
          "quip": "A fibrous one-seeded drupe! You brought high school biology trivia to a fruit fight.",
          "tier": "tooclever"
        },
        {
          "aliases": [
            "Apricots",
            "Albaricoque"
          ],
          "answer": "Apricot",
          "tier": "schooler"
        },
        {
          "aliases": [
            "Nectarines"
          ],
          "answer": "Nectarine",
          "tier": "schooler"
        },
        {
          "aliases": [
            "Dates",
            "Datiles",
            "Medjool date"
          ],
          "answer": "Date",
          "tier": "schooler"
        },
        {
          "aliases": [
            "Prunes",
            "Dried plum"
          ],
          "answer": "Prune",
          "tier": "schooler"
        },
        {
          "aliases": [
            "Litchi",
            "Litsiyas"
          ],
          "answer": "Lychee",
          "tier": "schooler"
        },
        {
          "aliases": [
            "Usaw"
          ],
          "answer": "Rambutan",
          "tier": "schooler"
        },
        {
          "aliases": [
            "Dragon eye fruit",
            "Lansones lookalike"
          ],
          "answer": "Longan",
          "tier": "schooler"
        },
        {
          "aliases": [
            "Spanish plum",
            "Sineguelas",
            "Red mombin",
            "Spondias purpurea"
          ],
          "answer": "Siniguelas",
          "tier": "schooler"
        },
        {
          "aliases": [
            "Cotton fruit",
            "Sandoricum koetjape"
          ],
          "answer": "Santol",
          "tier": "schooler"
        },
        {
          "aliases": [
            "Almonds",
            "Almendra"
          ],
          "answer": "Almond",
          "tier": "rare"
        },
        {
          "aliases": [
            "Pistachios",
            "Pistache"
          ],
          "answer": "Pistachio",
          "tier": "rare"
        },
        {
          "aliases": [
            "Blackberries",
            "Aggregate drupe"
          ],
          "answer": "Blackberry",
          "tier": "rare"
        },
        {
          "aliases": [
            "Raspberries"
          ],
          "answer": "Raspberry",
          "tier": "rare"
        },
        {
          "aliases": [
            "Velvet apple",
            "Kamagong fruit"
          ],
          "answer": "Mabolo",
          "tier": "rare"
        },
        {
          "aliases": [
            "Lipote berry",
            "Syzygium polycephaloides"
          ],
          "answer": "Lipote",
          "tier": "rare"
        },
        {
          "aliases": [
            "Java plum",
            "Black plum"
          ],
          "answer": "Duhat",
          "tier": "rare"
        },
        {
          "aliases": [
            "Bugnay",
            "Antidesma bunius",
            "Philippine wild berry"
          ],
          "answer": "Bignay",
          "tier": "rare"
        },
        {
          "aliases": [
            "Pili fruit",
            "Canarium ovatum fruit",
            "Pili"
          ],
          "answer": "Pili Nut Fruit",
          "tier": "deepcut"
        },
        {
          "aliases": [
            "Damson plum"
          ],
          "answer": "Damson",
          "tier": "deepcut"
        },
        {
          "aliases": [
            "Reine Claude"
          ],
          "answer": "Greengage",
          "tier": "deepcut"
        },
        {
          "aliases": [
            "Plumcot",
            "Aprium"
          ],
          "answer": "Pluot",
          "tier": "deepcut"
        },
        {
          "aliases": [
            "Harpephyllum caffrum"
          ],
          "answer": "Kaffir Plum",
          "tier": "deepcut"
        },
        {
          "aliases": [
            "Elephant fruit",
            "Sclerocarya birrea"
          ],
          "answer": "Marula",
          "tier": "deepcut"
        },
        {
          "aliases": [
            "Synsepalum dulcificum",
            "Miracle berry"
          ],
          "answer": "Miracle Fruit",
          "tier": "deepcut"
        },
        {
          "aliases": [
            "Green siniguelas with rock salt",
            "Manibalang na sineguelas"
          ],
          "answer": "Sineguelas na may asin sa plastic labo",
          "quip": "Munches straight through the skin while dodging the choking hazard seed under a summer santol tree. One in a Krillion!",
          "tier": "krillion"
        },
        {
          "aliases": [
            "Lunok santol seed",
            "Swallowed santol pit"
          ],
          "answer": "Santol Buko Seed Swallowed Whole",
          "quip": "The ultimate Pinoy ER nightmare your lola warned you about every summer. Deep trench danger!",
          "tier": "krillion"
        }
      ],
      "category": "universal",
      "hint": "Drupes and pitted fruits with a hard woody pit enclosing the seed",
      "id": "day15-p1",
      "text": "Name a fruit that contains a single hard stone or pit in the center (stone fruit / drupe)"
    },
    {
      "answers": [
        {
          "aliases": [
            "Halohalo",
            "Halo halo special"
          ],
          "answer": "Halo-Halo",
          "tier": "plankton"
        },
        {
          "aliases": [
            "Mais con hielo",
            "Corn with ice"
          ],
          "answer": "Mais con Yelo",
          "tier": "plankton"
        },
        {
          "aliases": [
            "Saging con yelo",
            "Banana con hielo"
          ],
          "answer": "Saba con Yelo",
          "tier": "plankton"
        },
        {
          "aliases": [
            "Dirty ice cream",
            "Pinoy ice cream"
          ],
          "answer": "Sorbetes",
          "tier": "plankton"
        },
        {
          "aliases": [
            "Buco pandan salad",
            "Buko pandan"
          ],
          "answer": "Buko Pandan",
          "tier": "plankton"
        },
        {
          "aliases": [
            "Iskrambol",
            "Skrambol",
            "Pink scramble"
          ],
          "answer": "Ice Scramble",
          "quip": "The neon-pink powdered milk nostalgia everyone thinks they are the only one remembering.",
          "tier": "tooclever"
        },
        {
          "aliases": [
            "Pinoy fruit salad",
            "Fiesta fruit salad"
          ],
          "answer": "Fruit Salad",
          "quip": "Condensed milk and all-purpose cream bath with drained canned cocktail. Classic holiday table crutch.",
          "tier": "tooclever"
        },
        {
          "aliases": [
            "Young coconut salad",
            "Buco salad"
          ],
          "answer": "Buko Salad",
          "tier": "schooler"
        },
        {
          "aliases": [
            "Sago at gulaman",
            "Samalamig"
          ],
          "answer": "Gulaman at Sago",
          "tier": "schooler"
        },
        {
          "aliases": [
            "Pinoy ice candy",
            "Mango ice candy",
            "Avocado ice candy"
          ],
          "answer": "Ice Candy",
          "tier": "schooler"
        },
        {
          "aliases": [
            "Crema de mangga",
            "Mango graham float",
            "Mango royale"
          ],
          "answer": "Mango Float",
          "tier": "schooler"
        },
        {
          "aliases": [
            "Mosaic gelatin",
            "Cathedral window"
          ],
          "answer": "Cathedral Window Gelatin",
          "tier": "schooler"
        },
        {
          "aliases": [
            "Halo-halo sa buko shell"
          ],
          "answer": "Buko Halo",
          "tier": "schooler"
        },
        {
          "aliases": [
            "Ube macapuno"
          ],
          "answer": "Macapuno Ice Cream",
          "tier": "schooler"
        },
        {
          "aliases": [
            "Cold leche flan",
            "Caramel custard"
          ],
          "answer": "Leche Flan Chilled",
          "tier": "schooler"
        },
        {
          "aliases": [
            "Cold ube halaya",
            "Purple yam jam"
          ],
          "answer": "Ube Halaya Chilled",
          "tier": "schooler"
        },
        {
          "aliases": [
            "Ginemis",
            "Pinipig and gulaman with coconut milk"
          ],
          "answer": "Guinomis",
          "tier": "rare"
        },
        {
          "aliases": [
            "Zamboanga knickerbocker",